{
  "schemaVersion": "1.0.0",
  "requestId": "DEVREQ-EVT-20260823-001",
  "productTaskId": "BR-0010",
  "deliveryTicketReference": ".product-ops/runtime/autopilot/product-runs/BR-0007-result.json",
  "title": "ساخت پلتفرم عمومی اجاره تجهیزات با پنل مدیریت",
  "problem": "تبدیل فرایند فعلی مبتنی بر اکسل به یک سایت فارسی مینیمال و مدرن برای انتخاب تجهیزات، تاریخ، ساعت، تعداد، محاسبه قیمت عمومی یا بوعلی، رزرو، هماهنگی تحویل و پرداخت کامل؛ همراه با پنل ادمین برای مدیریت موجودی، قیمت‌ها، تعطیلات، رزروها، پرداخت‌ها و ده قابلیت متمایز و کاربردی برای مشتری و مدیر.",
  "desiredOutcome": "مهندسی دامنه را به معماری، رابط، API، داده، امنیت، کیفیت، قابلیت اطمینان، SEO و مستندات تقسیم کند اما همه workstreamها را زیر یک قرارداد و یک ماتریس ردیابی نگه دارد.",
  "acceptanceCriteria": [
    {
      "id": "AC-01",
      "statement": "AC-01 کاتالوگ کامل اقلام، تصاویر، ظرفیت، ویژگی‌ها و قیمت آزاد/بوعلی را مطابق شیت قیمت نمایش دهد و قواعد لباس برای همه بازه‌ها قطعی و آزموده باشد.",
      "verification": "fixture منبع و آزمون واحد تمام ردیف‌های قیمت و مرزهای ۱، ۲–۳، ۴–۶، ۶–۱۰، ۱۰–۲۰ و ۲۰–۳۰ را مقایسه کند."
    },
    {
      "id": "AC-02",
      "statement": "AC-02 مشتری بتواند بازهٔ زمانی، اقلام و تعداد را انتخاب کند، موجودی زنده و جمع قیمت را ببیند و یک رزرو اتمیک بدون overbooking بسازد.",
      "verification": "آزمون integration رزرو موفق، ظرفیت ناکافی و دو درخواست همزمان برای آخرین ظرفیت را اجرا کند."
    },
    {
      "id": "AC-03",
      "statement": "AC-03 هویت کاربر، نقش عمومی/بوعلی و نقش مدیر در سمت سرور اعمال شود و قیمت بوعلی فقط پس از احراز معتبر فعال باشد.",
      "verification": "آزمون مجوز برای مهمان، مشتری مالک، مشتری دیگر، عضو بوعلی و مدیر روی APIها و صفحات محافظت‌شده عبور کند."
    },
    {
      "id": "AC-04",
      "statement": "AC-04 پرداخت مستقل از وضعیت رزرو، idempotent، قابل ممیزی و دارای adapter آزمون‌پذیر باشد؛ callback تکراری یا دستکاری‌شده دوباره مبلغ/رزرو را تغییر ندهد.",
      "verification": "آزمون webhook امضاشده، تکرار، خطا، timeout و reconciliation مدیر اجرا شود؛ فعال‌سازی provider واقعی فقط با راز معتبر گزارش شود."
    },
    {
      "id": "AC-05",
      "statement": "AC-05 مشتری از حساب خود وضعیت رزرو را پیگیری، در محدوده سیاست تغییر/لغو کند، رسید و رویدادهای تحویل/بازگشت را ببیند و تاریخچهٔ تغییرات حفظ شود.",
      "verification": "E2E مسیر ثبت تا پرداخت، تغییر، لغو مجاز/نامجاز و مشاهده تاریخچه را اجرا کند."
    },
    {
      "id": "AC-06",
      "statement": "AC-06 مدیر کاتالوگ، قیمت، ظرفیت، تقویم تعارض، رزرو، پرداخت، مشتری، تحویل، بازگشت، خسارت، ودیعه و گزارش را با RBAC و audit log مدیریت کند.",
      "verification": "E2E عملیات مدیر و آزمون جلوگیری از دسترسی مشتری، همراه read-back رویداد ممیزی اجرا شود."
    },
    {
      "id": "AC-07",
      "statement": "AC-07 زمان‌بندی ارسال/دریافت و تحویل/بازگشت با slot ظرفیت‌دار، مسئول، نشانی، یادداشت و وضعیت مستقل کار کند.",
      "verification": "آزمون ظرفیت slot، هم‌پوشانی، تغییر زمان و تکمیل handoff اجرا شود."
    },
    {
      "id": "AC-08",
      "statement": "AC-08 چک‌لیست دیجیتال تحویل و بازگشت شامل عکس، وضعیت کالا، امضا/تأیید، خسارت و دسترسی امن فایل‌ها باشد.",
      "verification": "آزمون upload نوع/اندازه، مالکیت فایل، URL امن، ثبت دو چک‌لیست و محاسبه خسارت اجرا شود."
    },
    {
      "id": "AC-09",
      "statement": "AC-09 هر ده قابلیت متمایز ارائه شود: موجودی بازه‌ای زنده، قیمت دوگانه شفاف، بسته‌ساز رویداد، waitlist خودکار، scheduler، سلف‌سرویس تغییر، یادآور/تقویم، handoff دیجیتال، تقویم تعارض مدیر و تحلیل تقاضا/درآمد.",
      "verification": "برای هر قابلیت حداقل یک سناریوی E2E یا integration مستقل و یک شاهد UI/API ثبت شود."
    },
    {
      "id": "AC-10",
      "statement": "AC-10 یادآورها و اعلان‌ها برای رویدادهای رزرو، پرداخت، تحویل و بازگشت قابل صف‌بندی، retry و لغو باشند و خروجی تقویم تولید شود.",
      "verification": "آزمون زمان‌بندی، deduplication، retry، opt-out و فایل تقویم معتبر اجرا شود."
    },
    {
      "id": "AC-11",
      "statement": "AC-11 تحلیل مدیر فقط از دادهٔ مجاز و پایدار، با بازه زمانی، تفکیک درآمد/تقاضا/بهره‌برداری و حالت دادهٔ خالی تولید شود.",
      "verification": "آزمون aggregate روی dataset قطعی و مقایسه با محاسبه مرجع اجرا شود."
    },
    {
      "id": "AC-12",
      "statement": "AC-12 داده در D1 با migration نسخه‌شده، قیود، ایندکس و rollback/بازیابی مستند نگهداری و فایل‌ها در R2 با سیاست retention و مالکیت ذخیره شوند.",
      "verification": "migration روی پایگاه خالی و ارتقای نسخه اجرا، schema read-back و سناریوی بازیابی/حذف فایل اثبات شود."
    },
    {
      "id": "AC-13",
      "statement": "AC-13 رابط فارسی RTL روی موبایل و دسکتاپ، دسترس‌پذیر با صفحه‌کلید و screen reader، و دارای حالت‌های loading/empty/error/success باشد.",
      "verification": "آزمون خودکار accessibility، مرور صفحه‌کلید، کنتراست و screenshot در viewportهای اصلی ثبت شود."
    },
    {
      "id": "AC-14",
      "statement": "AC-14 امنیت شامل validation ورودی، CSRF/authorization، rate limit، مدیریت راز، محافظت XSS/SQL، privacy/retention و secret/dependency scan باشد.",
      "verification": "threat model و regressionهای امنیتی، scan راز و dependency audit با disposition مستند اجرا شود."
    },
    {
      "id": "AC-15",
      "statement": "AC-15 سامانه metadata، sitemap/robots، داده ساختاریافته معتبر، لاگ ساختاریافته، شناسه همبستگی، health/error telemetry و بودجه عملکرد داشته باشد.",
      "verification": "SEO audit، structured-data validation، health/readiness و تست performance budget اجرا شود."
    },
    {
      "id": "AC-16",
      "statement": "AC-16 build تولیدی تکرارپذیر، تست‌های unit/integration/E2E سبز، مستندات راه‌اندازی/عملیات/rollback کامل و deployment خصوصی قابل health-check باشد.",
      "verification": "فرمان‌های نصب قفل‌شده، lint، typecheck، test، build، migration، deploy و smoke با digest و disposition مستقل ثبت شوند."
    }
  ],
  "impacts": [
    "architecture",
    "frontend",
    "accessibility",
    "backend",
    "api",
    "integration",
    "database",
    "storage",
    "analytics",
    "security",
    "privacy",
    "identity",
    "observability",
    "performance",
    "resilience",
    "cost",
    "seo",
    "documentation"
  ],
  "constraints": [
    "Owner condition on development export: نسخه نهایی، نه MVP، توسعه داده شود.",
    "Owner condition on development export: دامنه کامل صفر تا صد تا نقطه انتهایی پیش برود.",
    "رابط اصلی فارسی، راست‌به‌چپ، مینیمال و مدرن باشد.",
    "مالک محصول اختیار نهایی دامنه، اولویت، پذیرش ریسک و تأیید تجربهٔ کاربر را حفظ می‌کند.",
    "تا زمان دسترسی به منبع اکسل، قیمت‌ها، اقلام، ظرفیت‌ها و قواعد عملیاتی فرض نشوند.",
    "هیچ اقدام تولیدی، پرداخت واقعی یا استفاده از دادهٔ شخصی در این مرحله مجاز نیست.",
    "منابع اکتشاف فعلی به رکوردهای معتبر همین مخزن محدودند.",
    "نبود فایل اکسل، نبود قاعده را اثبات نمی‌کند و فقط یک شکاف شواهد است.",
    "هیچ دادهٔ واقعی مشتری، قیمت واقعی یا نتیجهٔ پژوهش کاربر در این مرحله ثبت نشده است.",
    "تصمیم دامنه و اولویت فقط با مالک محصول است.",
    "هیچ گزینه‌ای بدون پاسخ صریح و ثبت‌شدهٔ مالک محصول تصویب نیست.",
    "منبع اکسل در محیط فعلی موجود نیست و هر داده یا قاعدهٔ جایگزین باید مصنوعی و موقت برچسب بخورد.",
    "پرداخت واقعی، انتشار عمومی، تولید و دادهٔ شخصی خارج از مجوز این تصمیم‌اند.",
    "ده قابلیت متمایز هنوز تعریف و اولویت‌بندی نشده‌اند.",
    "تصمیم مالک محصول دامنهٔ کامل را الزام می‌کند و کوچک‌سازی به MVP مجاز نیست.",
    "پرداخت واقعی به درگاه دارای قرارداد و راز معتبر نیاز دارد؛ هیچ کلید یا رسید تولیدی نباید در مخزن ذخیره شود.",
    "تاریخ‌های اکسل بدون سال و ساعت به‌عنوان واقعیت تقویم زنده وارد نمی‌شوند.",
    "D1 منبع حقیقت دادهٔ ساختاری و R2 محل فایل و تصویر است؛ browser storage منبع حقیقت رزرو نیست.",
    "ورود ChatGPT هویت را اثبات می‌کند اما مجوز مدیر را اثبات نمی‌کند؛ نقش مدیر باید سمت‌سرور و صریح باشد.",
    "انتشار تولیدی و دسترسی عمومی همچنان دروازهٔ جداگانهٔ انسانی دارند.",
    "دامنهٔ کامل و ادامه تا نقطهٔ انتهایی شرط صریح مالک محصول است.",
    "تکمیل فقط با شواهد runtime، آزمون و verification مستقل قابل ثبت است.",
    "پرداخت تولیدی، رازها و انتشار عمومی مجوزهای جداگانه می‌خواهند.",
    "تاریخ‌های تاریخی فاقد سال/ساعت، تقویم زنده محسوب نمی‌شوند.",
    "سیاست زنجیرهٔ تأمین وابستگی‌ها قابل دورزدن نیست.",
    "این تحویل نسخهٔ نهایی است و کوچک‌سازی آن به MVP یا حذف هر یک از ده قابلیت مجاز نیست.",
    "ادعای تکمیل فقط با شواهد اجرا و verification مستقل پذیرفته می‌شود.",
    "وابستگی‌ها باید policy حداقل سن انتشار را رعایت کنند و نسخه یا تنظیمات برای دورزدن آن تغییر نکند.",
    "راز، حساب provider پرداخت و مجوز انتشار عمومی خارج از مخزن هستند و هیچ مقدار ساختگی یا hard-coded مجاز نیست.",
    "رکوردهای تاریخی اکسل دادهٔ مرجع تقویم زنده نیستند و فقط برای درک فرایند/fixture ناشناس استفاده می‌شوند.",
    "نسخهٔ نهایی و هر ده قابلیت باید در دامنهٔ اجرا بمانند.",
    "داده آزمون synthetic است و داده تاریخی شناسایی‌پذیر وارد محیط تست نمی‌شود.",
    "درگاه واقعی فقط با credentials معتبر آزموده می‌شود؛ adapter محلی می‌تواند منطق را اثبات کند اما فعال‌سازی provider را ثابت نمی‌کند.",
    "policy حداقل سن وابستگی قابل دورزدن نیست و فعلاً entry criterion نصب را مسدود کرده است.",
    "ممیزی دامنهٔ کامل را کاهش نمی‌دهد و حذف قابلیت را به‌عنوان کنترل ریسک پیشنهاد نمی‌کند.",
    "artifactهای قرارداد/اعتبارسنجی فقط از مسیر مالک و اصلاح کنترل‌شده تغییر می‌کنند.",
    "verification باید توسط actor مستقل انجام شود.",
    "No production credentials or production-derived customer data",
    "Database and infrastructure changes must be reversible"
  ],
  "nonFunctionalRequirements": [
    {
      "domain": "دسترس‌پذیری و زبان",
      "requirement": "مسیرهای اصلی رزرو و مدیریت با چیدمان راست‌به‌چپ، متن فارسی خوانا و کنترل‌های قابل‌استفاده با صفحه‌کلید طراحی شوند.",
      "verification": "در طرح اعتبارسنجی، بررسی RTL، ترتیب فوکوس، برچسب کنترل‌ها و کنتراست برای مسیرهای اصلی وجود داشته باشد."
    },
    {
      "domain": "امنیت و حریم خصوصی",
      "requirement": "دسترسی مدیر از مشتری جدا باشد و تنها حداقل دادهٔ لازم برای رزرو و پرداخت نگهداری شود.",
      "verification": "قرارداد تحویل، نقش‌ها، فیلدهای حساس و آزمون‌های منع دسترسی غیرمجاز را مشخص کند."
    },
    {
      "domain": "یکپارچگی رزرو",